Step,Target Date,Measurement (SG),Notes
Start Fermentation (OG Measurement),2025-03-30,OG ~1.075,Record original gravity and temperature
Check Fermentation (1st FG Measurement),2025-04-06,FG ~1.010,"If FG ~1.010, wait 2 more days and re-check"
Confirm FG & Bottle (2nd FG Measurement),2025-04-09,Same as above (stable 48h),"If stable, proceed to bottling with 126g sugar in solution"
End of Secondary Fermentation (Carbonation),2025-04-23,,Store at 18–23°C
End of Maturation (Ready to drink),2025-06-04,,"Store at 10–15°C, taste test optional"
